{
    "name": "simple-splash",
    "type": "init",
    "priority": 0,
    "support": [
        "linux/amd64",
        "linux/arm64"
    ],
    "targetDeps": [
        "procps",
        "systemd",
        "patchelf",
        "python3",
        "python3-pip",
        "scons",
        "fbset",
        "fbi"
    ],
    "afterDeployRecipes": [
        "config.ts"
    ],
    "initramfsRecipes": [
        "deployInit.sh"
    ]
}
