{
    "name": "custom-feed",
    "type": "config",
    "priority": 0,
    "support": [
        "linux/amd64",
        "linux/arm64"
    ],
    "targetDeps": [
        "lz4"
    ],
    "hostDeps": [
        "lz4"
    ],
    "customData": {},
    "beforeTargetDepsRecipes": [
        "apply-custom-feed.ts"
    ]
}
