{
    "name": "edit",
    "type": "application",
    "priority": 0,
    "version": "2.0.0",
    "support": [
        "linux/amd64",
        "linux/arm64"
    ],
    "hostDeps": [
        "wget",
        "tar",
        "zstd"
    ],
    "fetchRecipes": [
        "fetch.ts"
    ],
    "deployRecipes": [
        "deploy.ts"
    ],
    "sbomRecipes": [
        "msedit-sbom.ts"
    ]
}
