{
    "name": "neofetch",
    "type": "config",
    "priority": 0,
    "support": [
        "linux/amd64",
        "linux/arm64"
    ],
    "source": "https://github.com/dylanaraps/neofetch",
    "ref": {
        "linux/amd64": "60d07dee6b76769d8c487a40639fb7b5a1a7bc85",
        "linux/arm64": "60d07dee6b76769d8c487a40639fb7b5a1a7bc85"
    },
    "fetchRecipes": [
        "fetch.ts"
    ],
    "deployRecipes": [
        "deploy.ts"
    ]
}
