{
    "name": "linux",
    "type": "kernel",
    "priority": 0,
    "source": "https://github.com/gaiaBuildSystem/linux.git",
    "support": [
        "linux/arm64",
        "linux/amd64"
    ],
    "ref": {
        "linux/arm64": "8cd9520d35a6c38db6567e97dd93b1f11f185dc6",
        "linux/amd64": "8cd9520d35a6c38db6567e97dd93b1f11f185dc6"
    },
    "customData": {
        "ref": {
            "stable": {
                "linux/arm64": "8cd9520d35a6c38db6567e97dd93b1f11f185dc6",
                "linux/amd64": "8cd9520d35a6c38db6567e97dd93b1f11f185dc6"
            },
            "edge": {
                "linux/arm64": "c03c1a14507dfaf8b856c2608f9ac216021fc222",
                "linux/amd64": "c03c1a14507dfaf8b856c2608f9ac216021fc222"
            }
        }
    },
    "hostDeps": [
        "git",
        "make"
    ],
    "targetDeps": [],
    "fetchRecipes": [
        "fetch.ts"
    ],
    "patchRecipes": [],
    "buildRecipes": [
        "build.ts"
    ],
    "deployRecipes": [
        "deploy.ts"
    ],
    "cleanRecipes": [],
    "sbomRecipes": [
        "linux-sbom.ts"
    ]
}
