{
    "name": "u-boot",
    "type": "bootloader",
    "priority": 0,
    "source": "https://github.com/gaiaBuildSystem/u-boot",
    "support": [
        "linux/arm64",
        "linux/amd64"
    ],
    "ref": {
        "linux/arm64": "0ceda00a85b63aafe1c1a2f96e3b1948e182cd14",
        "linux/amd64": "3f4b7adc2052ab90a507048cd5a63633a7dc2ce8"
    },
    "hostDeps": [
        "git"
    ],
    "targetDeps": [
        "u-boot-tools"
    ],
    "fetchRecipes": [
        "fetch.ts"
    ],
    "patchRecipes": [],
    "buildRecipes": [
        "build.ts"
    ],
    "deployRecipes": [
        "deploy.ts",
        "fw.ts"
    ],
    "afterDeployRecipes": [
        "efi-payload.ts",
        "splash.ts"
    ],
    "sbomRecipes": [
        "uboot-sbom.ts"
    ]
}
