{
    "name": "motd",
    "type": "package",
    "priority": 0,
    "support": [
        "linux/amd64",
        "linux/arm64"
    ],
    "env": {
        "MOTD_MESSAGE": "DeimOS comes with ABSOLUTELY NO WARRANTY, to the extent permitted by applicable law."
    },
    "deployRecipes": [
        "deploy.ts"
    ]
}
