{
    "name": "systemd",
    "type": "init",
    "priority": 0,
    "support": [
        "linux/amd64",
        "linux/arm64"
    ],
    "targetDeps": [
        "systemd",
        "systemd-sysv",
        "systemd-timesyncd",
        "network-manager"
    ],
    "afterTargetDepsRecipes": [
        "config.ts"
    ]
}
