{
    "name": "initramfs",
    "type": "init",
    "priority": 0,
    "support": [
        "linux/amd64",
        "linux/arm64"
    ],
    "targetDeps": [
        "curl",
        "cpio",
        "gzip",
        "binutils",
        "patchelf",
        "python3",
        "python3-pip",
        "scons",
        "php",
        "busybox-static",
        "fbset",
        "fbi"
    ],
    "afterDeployRecipes": [
        "build.ts"
    ]
}
