{
    "name": "debian-bookworm",
    "type": "rootfs",
    "priority": 0,
    "support": [
        "linux/amd64",
        "linux/arm64"
    ],
    "checksum": {
        "linux/amd64": "3f03ff2fca74e47cee05599e36e1f1258d386895a3394b3683df333f404f4e8a",
        "linux/arm64": "53692cdc49e2b0abdd9adf36466b366aaebdbbdbb2e6a7f432e2b4fb7327fd93"
    },
    "env": {
        "BOOT_LABEL": "BOOT",
        "ROOT_LABEL": "gaia"
    },
    "hostDeps": [
        "mount",
        "xz-utils",
        "kpartx",
        "e2fsprogs",
        "pipx",
        "lz4",
        "xterm"
    ],
    "targetDeps": [
        "kmod",
        "locales",
        "sudo",
        "bash",
        "bash-completion",
        "util-linux",
        "htop",
        "e2fsprogs",
        "parted",
        "dbus",
        "udev",
        "network-manager",
        "polkitd",
        "net-tools",
        "resolvconf"
    ],
    "fetchRecipes": [
        "fetch.ts"
    ],
    "patchRecipes": [],
    "buildRecipes": [
        "disk.ts",
        "buildRootfs.ts"
    ],
    "deployRecipes": [
        "update.ts"
    ],
    "sbomRecipes": [
        "sbom.ts"
    ],
    "cleanRecipes": [
        "umount.ts"
    ]
}
