{
    "name": "userlogin",
    "type": "config",
    "priority": 0,
    "support": [
        "linux/amd64",
        "linux/arm64"
    ],
    "env": {
        "USER_LOGIN_USER": "reference",
        "USER_LOGIN_PASSWORD": "reference",
        "USER_ROOT_PASSWORDLESS": "true",
        "USER_DEFAULT_SHELL": "/bin/bash"
    },
    "hostDeps": [
        "whois",
        "sudo"
    ],
    "afterDeployRecipes": [
        "create.ts"
    ]
}
